<?xml version="1.0" encoding="utf-8"?>
<?xml-stylesheet type="text/xsl" href="/bio_by_id/bio.xsl"?>
<!DOCTYPE name SYSTEM "/bio_by_id/bio.dtd">
<name id="name_id" real_name="name">
	<addresses>
		<location name="Washington">
			<address location="Washington">
				<![CDATA[ foo
				]]>
        	        </address>
			<phone location="Washington"> foo </phone>
			<fax location="Washington"> foo </fax>
		</location>
		<location name="District Offices">
			<address location="District Office">
				<![CDATA[ foo 
				]]>
        	        </address>
			<phone location="District Office"> foo </phone>
			<fax location="District Office"> foo </fax>
		</location>
		<location name="District Office">
			<address location="District Office">
				<![CDATA[ foo 
				]]>
                	</address>
			<phone location="District Office"> foo </phone>
			<fax location="District Office"> foo </fax>
		</location>
		<location name="District Office">
			<address location="District Office">
				<![CDATA[ foo  
				]]>
	                </address>
			<phone location="District Office"> foo </phone>
			<fax location="District Office"> foo </fax>
		</location>
		<location name="District Office">
			<address location="District Office">
				<![CDATA[ foo 
				]]>
                	</address>
			<phone location="District Office"> foo </phone>
			<fax location="District Office"> foo </fax>
		</location>
		<location name="District Office">
			<address location="District Office">
				<![CDATA[ foo 
				]]>
                	</address>
			<phone location="District Office"> foo </phone>
			<fax location="District Office"> foo </fax>
		</location>
		<location name="District Office">
			<address location="District Office">
				<![CDATA[ foo  
				]]>
	                </address>
			<phone location="District Office"> foo </phone>
			<fax location="District Office"> foo </fax>
		</location>
	</addresses>
	<online_presence>
		<homepage name="Homepage" url="foo"/>
		<facebook name="Facebook" url="foo"/>
		<twitter name="Twitter" url="foo"> @foo </twitter>
		<youtube name="YouTube" url="foo"/>
		<other name="foo" url="foo"/>
	</online_presence>
	<demographics>
		<alias name="Also Known As"> foo </alias>
		<born name="Born"> foo </born>
		<birthplace name="Birthplace"> foo </birthplace>
		<gender name="Gender"> foo </gender>
		<religion name="Religion"> foo </religion>
		<ethnicity name="Race or Ethnicity"> foo </ethnicity>
		<occupation name="Occupation"> foo </occupation>
		<party_affiliation name="Party Affiliation"> foo </party_affiliation>
		<nationality name="Nationality"> foo </nationality>
	</demographics>	
	<career>
		<university> foo </university>
		<grad_school> foo </grad_school>
		<additional_school> foo </additional_school>
		<first>  foo </first>
		<second> foo </second>
		<third> foo </third>
		<fourth> foo </fourth>
		<fifth> foo </fifth>
		<sixth> foo </sixth>
		<seventh> foo </seventh>
		<eighth>  foo </eighth>
		<ninth> foo </ninth>
		<current> foo </current>
	</career>
	<committee_membership>
		<committee id="1">
			<oversight_committee id="A"> foo </oversight_committee>
                                <subcommittees>
					<subcommittee id="a"> foo </subcommittee>
					<subcommittee id="b"> foo </subcommittee>
                                </subcommittees>
		</committee>
		<committee id="2"> 
			<oversight_committee id="B"> foo </oversight_committee>
                                <subcommittees>
					<subcommittee id="a"> foo </subcommittee>
					<subcommittee id="b"> foo </subcommittee>
                                </subcommittees>
		</committee>
		<committee id="3">
			<oversight_committee id="C"> foo </oversight_committee>
				<subcommittees>
					<subcommittee id="a"> foo </subcommittee>
					<subcommittee id="b"> foo </subcommittee>
				</subcommittees>
		</committee>
		<committee id="4">
			<oversight_committee id="D"> foo </oversight_committee>
                                <subcommittees>
					<subcommittee id="a"> foo </subcommittee>
					<subcommittee id="b"> foo </subcommittee>
                                </subcommittees>
		</committee>
		<committee id="5"> 
			<oversight_committee id="E"> foo </oversight_committee>
                                <subcommittees>
					<subcommittee id="a"> foo </subcommittee>
					<subcommittee id="b"> foo </subcommittee>
                                </subcommittees>
		</committee>
		<committee id="6">
			<oversight_committee id="F"> foo </oversight_committee>
				<subcommittees>
					<subcommittee id="a"> foo </subcommittee>
					<subcommittee id="b"> foo </subcommittee>
				</subcommittees>
		</committee>
		<committee id="7">
			<oversight_committee id="G"> foo </oversight_committee>
				<subcommittees>
					<subcommittee id="a"> foo </subcommittee>
					<subcommittee id="b"> foo </subcommittee>
				</subcommittees>
		</committee>
		<committee id="8">
			<oversight_committee id="H"> foo </oversight_committee>
                                <subcommittees>
					<subcommittee id="a"> foo </subcommittee>
					<subcommittee id="b"> foo </subcommittee>
                                </subcommittees>
		</committee>
		<committee id="9"> 
			<oversight_committee id="I"> foo </oversight_committee>
                                <subcommittees>
					<subcommittee id="a"> foo </subcommittee>
					<subcommittee id="b"> foo </subcommittee>
                                </subcommittees>
		</committee>
		<committee id="10">
			<oversight_committee id="J"> foo </oversight_committee>
				<subcommittees>
					<subcommittee id="a"> foo </subcommittee>
					<subcommittee id="b"> foo </subcommittee>
				</subcommittees>
		</committee>
	</committee_membership>
	<office_staff>
		<chief name="Chief of Staff"> foo </chief>
		<scheduler name="Scheduler"> foo </scheduler>
		<leg_director name="Legislative Director"> foo </leg_director>
		<com_director name="Communications Director"> foo </com_director>
	</office_staff>
</name>
